reference_id,title,journal,publication_date,volume,issue,pages,doi,pmid,url,notes,created_at,updated_at
RE00520,ImmunoPET Imaging of Trop2 Expression in Bladder Cancer Using [64Cu]Cu-NOTA-Trodelvy,Mol Pharm,2025-04-07,22,4,2266-2275,10.1021/acs.molpharmaceut.5c00069,40059341,https://doi.org/10.1021/acs.molpharmaceut.5c00069,,,
RE00521,Abstracts from the 20th European symposium on radiopharmacy and radiopharmaceuticals,EJNMMI Radiopharm Chem,2023-06-15,8,Suppl 1,11,10.1186/s41181-023-00193-4,37318633,https://doi.org/10.1186/s41181-023-00193-4,,,
RE00522,Preclinical evaluation of the theranostic potential of 89Zr/177Lu-labeled anti-TROP-2 antibody in triple-negative breast cancer model,EJNMMI Radiopharm Chem,2024-01-09,9,1,5,10.1186/s41181-023-00235-x,38194043,https://doi.org/10.1186/s41181-023-00235-x,,,
RE00523,ImmunoPET of trophoblast cell-surface antigen 2 (Trop-2) expression in pancreatic cancer,Eur J Nucl Med Mol Imaging,2022-02-01,49,3,861-870,10.1007/s00259-021-05563-1,34519889,https://doi.org/10.1007/s00259-021-05563-1,,,
RE00524,Pretargeted immunoPET of prostate cancer with an anti-TROP-2 x anti-HSG bispecific antibody in mice with PC3 xenografts,Mol Imaging Biol,2015-02-01,17,1,94-101,10.1007/s11307-014-0772-x,25060065,https://doi.org/10.1007/s11307-014-0772-x,,,
RE00525,Tissue Factor-Targeted ImmunoPET Imaging and Radioimmunotherapy of Anaplastic Thyroid Cancer,Adv Sci (Weinh),2020-05-17,7,13,1903595,10.1002/advs.201903595,32670751,https://doi.org/10.1002/advs.201903595,,,
RE00526,Pretargeted dual-modality immuno-SPECT and near-infrared fluorescence imaging for image-guided surgery of prostate cancer,Cancer Res,2014-11-01,74,21,6216-23,10.1158/0008-5472.CAN-14-0594,25252911,https://doi.org/10.1158/0008-5472.can-14-0594,,,
RE00527,A comparison of the imaging characteristics and microregional distribution of 4 hypoxia PET tracers,J Nucl Med,2014-03-01,55,3,515-21,10.2967/jnumed.113.126615,24491409,https://doi.org/10.2967/jnumed.113.126615,,,
RE00528,New peptide receptor radionuclide therapy of invasive cancer cells: in vivo studies using 177Lu-DOTA-AE105 targeting uPAR in human colorectal cancer xenografts,Nucl Med Biol,2012-10-01,39,7,962-9,10.1016/j.nucmedbio.2012.05.007,22739362,https://doi.org/10.1016/j.nucmedbio.2012.05.007,,,
RE00529,Preclinical evaluation of zirconium-89 labeled anti-Trop2 antibody-drug conjugate (Trodelvy) for imaging in gastric cancer and triple-negative breast cancer,Eur J Nucl Med Mol Imaging,2025-06-01,52,7,2369-2383,10.1007/s00259-025-07106-4,39878898,https://doi.org/10.1007/s00259-025-07106-4,,,
RE00530,[89Zr]Zr-DFO-Trodelvy immunoPET for noninvasive Trop2 imaging in bladder cancer,Am J Nucl Med Mol Imaging,2025-06-25,15,3,87-96,10.62347/KKEE6954,40688533,https://doi.org/10.62347/kkee6954,,,
RE00531,ImmunoPET imaging of Trop2 expression in triple-negative breast cancer using [64Cu]Cu-NOTA-Trodelvy-F(ab')2,Eur J Nucl Med Mol Imaging,2025-07-01,52,9,3223-3237,10.1007/s00259-025-07167-5,39994021,https://doi.org/10.1007/s00259-025-07167-5,,,
RE00532,Development of a [89Zr]Zr-labeled Human Antibody using a Novel Phage-displayed Human scFv Library,Clin Cancer Res,2024-04-01,30,7,1293-1306,10.1158/1078-0432.CCR-23-3647,38277241,https://doi.org/10.1158/1078-0432.ccr-23-3647,,,
RE00533,"Imaging with [89Zr]Zr-DFO-SC16.56 anti-DLL3 antibody in patients with high-grade neuroendocrine tumours of the lung and prostate: a phase 1/2, first-in-human trial",Lancet Oncol,2024-08-01,25,8,1015-1024,10.1016/S1470-2045(24)00249-3,38950555,https://doi.org/10.1016/s1470-2045(24)00249-3,,,
RE00534,Synthesis and Comparative In Vivo Evaluation of Site-Specifically Labeled Radioimmunoconjugates for DLL3-Targeted ImmunoPET,Bioconjug Chem,2021-07-21,32,7,1255-1262,10.1021/acs.bioconjchem.1c00121,33835770,https://doi.org/10.1021/acs.bioconjchem.1c00121,,,
RE00535,Noninvasive evaluation of PD-L1 expression using Copper 64 labeled peptide WL12 by micro-PET imaging in Chinese hamster ovary cell tumor model,Bioorg Med Chem Lett,2021-05-15,40,,127901,10.1016/j.bmcl.2021.127901,33705912,https://doi.org/10.1016/j.bmcl.2021.127901,,,
RE00536,Whole-body PET tracking of a d-dodecapeptide and its radiotheranostic potential for PD-L1 overexpressing tumors,Acta Pharm Sin B,2022-03-01,12,3,1363-1376,10.1016/j.apsb.2021.09.016,35530129,https://doi.org/10.1016/j.apsb.2021.09.016,,,
RE00537,Determining the Multivalent Effects of d-Peptide-Based Radiotracers,Chem Biomed Imaging,2025-01-30,30,3,180-190,10.1021/cbmi.4c00071,40151821,https://doi.org/10.1021/cbmi.4c00071,,,
RE00538,89Zr-atezolizumab imaging as a non-invasive approach to assess clinical response to PD-L1 blockade in cancer,Nat Med,2018-12-01,24,12,1852-1858,10.1038/s41591-018-0255-8,30478423,https://doi.org/10.1038/s41591-018-0255-8,,,
RE00539,[89Zr]-Atezolizumab-PET Imaging Reveals Longitudinal Alterations in PDL1 during Therapy in TNBC Preclinical Models,Cancers (Basel),2023-05-11,15,10,2708,10.3390/cancers15102708,37345044,https://doi.org/10.3390/cancers15102708,,,
RE00540,PD-L1 detection using 89Zr-atezolizumab immuno-PET in renal cell carcinoma tumorgrafts from a patient with favorable nivolumab response,J Immunother Cancer,2019-06-03,7,1,144,10.1186/s40425-019-0607-z,31155004,https://doi.org/10.1186/s40425-019-0607-z,,,
RE00541,Radiosynthesis and preclinical PET evaluation of 89Zr-nivolumab (BMS-936558) in healthy non-human primates,Bioorg Med Chem,2017-10-15,25,20,5407-5414,10.1016/j.bmc.2017.07.066,28803798,https://doi.org/10.1016/j.bmc.2017.07.066,,,
RE00542,Preclinical immunoPET/CT imaging using Zr-89-labeled anti-PD-L1 monoclonal antibody for assessing radiation-induced PD-L1 upregulation in head and neck cancer and melanoma,Oncoimmunology,2017-05-19,6,7,e1329071,10.1080/2162402X.2017.1329071,28811971,https://doi.org/10.1080/2162402x.2017.1329071,,,
RE00543,Preclinical Pharmacokinetics and Dosimetry of an 89Zr Labelled Anti-PDL1 in an Orthotopic Lung Cancer Murine Model,Front Med (Lausanne),2022-01-31,8,,741855,10.3389/fmed.2021.741855,35174180,https://doi.org/10.3389/fmed.2021.741855,,,
RE00544,Rapid PD-L1 detection in tumors with PET using a highly specific peptide,Biochem Biophys Res Commun,2017-01-29,483,1,258-263,10.1016/j.bbrc.2016.12.156,28025143,https://doi.org/10.1016/j.bbrc.2016.12.156,,,
RE00545,Synthesis and preclinical evaluation of small molecule-based radiotracers for PET imaging of PD-L1 expression and dynamics,Eur J Nucl Med Mol Imaging,2025-09-01,52,11,4112-4124,10.1007/s00259-025-07290-3,40263208,https://doi.org/10.1007/s00259-025-07290-3,,,
RE00546,Immuno-PET imaging of 68Ga-labeled nanobody Nb109 for dynamic monitoring the PD-L1 expression in cancers,Cancer Immunol Immunother,2021-06-01,70,6,1721-1733,10.1007/s00262-020-02818-y,33386467,https://doi.org/10.1007/s00262-020-02818-y,,,
RE00547,Immuno-PET imaging of PD-L1 expression in patient-derived lung cancer xenografts with [68Ga]Ga-NOTA-Nb109,Quant Imaging Med Surg,2022-06-01,12,6,3300-3313,10.21037/qims-21-991,35655844,https://doi.org/10.21037/qims-21-991,,,
RE00548,A preclinical study: correlation between PD-L1 PET imaging and the prediction of therapy efficacy of MC38 tumor with 68Ga-labeled PD-L1 targeted nanobody,Aging (Albany NY),2021-04-27,13,9,13006-13022,10.18632/aging.202775 (from journal),33910164,https://doi.org/10.18632/aging.202981,,,
RE00549,PET Imaging of Tumor PD-L1 Expression with a Highly Specific Nonblocking Single-Domain Antibody,J Nucl Med,2020-01-01,61,1,117-122,10.2967/jnumed.119.226712,31253743,https://doi.org/10.2967/jnumed.119.226712,,,
RE00550,Synthesis and biological evaluation of Al[18F]-NOTA-IPB-PDL1P as a molecular probe for PET imaging of PD-L1 positive tumors,Bioorg Chem,2022-05-01,122,,105682,10.1016/j.bioorg.2022.105682,35278777,https://doi.org/10.1016/j.bioorg.2022.105682,,,
RE00551,Sulfonamide derivative targeting carbonic anhydrase IX as a nuclear imaging probe for colorectal cancer detection in vivo,Oncotarget,2015-11-03,6,34,36139-55,"10.18632/oncotarget.5335
",26447758,https://doi.org/10.18632/oncotarget.5684,,,
RE00552,A novel 111indium-labeled dual carbonic anhydrase 9-targeted probe as a potential SPECT imaging radiotracer for detection of hypoxic colorectal cancer cells,Eur J Pharm Biopharm,2021-11-01,168,,38-52,"10.1016/j.ejpb.2021.08.004
",34450241,https://doi.org/10.1016/j.ejpb.2021.08.004,,,
RE00553,"First-in-Human Safety, Imaging, and Dosimetry of a Carbonic Anhydrase IX-Targeting Peptide, [68Ga]Ga-DPI-4452, in Patients with Clear Cell Renal Cell Carcinoma",J Nucl Med,2024-02-22,65,5,740-743, 10.2967/jnumed.123.267175,38388517,https://doi.org/10.2967/jnumed.123.267175,,,
RE00554,Evaluation of PET/CT imaging with [89Zr]Zr-DFO-girentuximab: a phase 1 clinical study in Japanese patients with renal cell carcinoma (Zirdac-JP),Jpn J Clin Oncol,2024-08-14,54,8,873-879,10.1093/jjco/hyae075,38864246,https://doi.org/10.1093/jjco/hyae075,,,
RE00555,Optimizing lutetium 177-anti-carbonic anhydrase IX radioimmunotherapy in an intraperitoneal clear cell renal cell carcinoma xenograft model,Mol Imaging,2014-01-01,13,,,10.2310/7290.2014.00008,24824962,https://doi.org/10.2310/7290.2014.00008,,,
RE00556,Phase 1 radioimmunotherapy study with lutetium 177-labeled anti-carbonic anhydrase IX monoclonal antibody girentuximab in patients with advanced renal cell carcinoma,Eur Urol,2013-09-01,64,3,478-85,10.1016/j.eururo.2012.08.024,22980441,https://doi.org/10.1016/j.eururo.2012.08.024,,,
RE00557,A cutting-edge 68Ga-labeled bicyclic peptide PET molecular probe for noninvasive assessment of Nectin4 expression,Bioorganic chemistry,2024-08-28,152,,107745,10.1016/j.bioorg.2024.107745,39213795,https://doi.org/10.1016/j.bioorg.2024.107745,,,
RE00558,Azirconium-89-labeled antibody-drug conjugate PET probe for noninvasive monitoring of Nectin4 expression in breast cancer and lung cancer,Cell reports Physical Science,2025-08-20,6,8,102723,10.1016/j.xcrp.2025.102723,41551852,https://doi.org/10.1016/j.xcrp.2025.102723,,,
RE00559,ImmunoPET Imaging of Nectin4 Expression in Gastric and Bladder Cancer Using [64Cu]Cu-NOTA-Padcev,Molecular pharmaceutics,2025-05-08,22,6,3468-3478,10.1021/acs.molpharmaceut.5c00469,40338113,https://pubs.acs.org/doi/10.1021/acs.molpharmaceut.5c00469,,,
RE00560,First-in-Human Study of the Radioligand 68Ga-N188 Targeting Nectin-4 for PET/CT Imaging of Advanced Urothelial Carcinoma,Clinical cancer research : an official journal of the American Association for Cancer Research,2023-09-01,29,17,3395-3407,10.1158/1078-0432.CCR-23-0609,37093191,https://doi.org/10.1158/1078-0432.CCR-23-0609,,,
RE00561,Translational PET Imaging of Nectin-4 Expression in Multiple Different Cancers with 68Ga-N188.,"Journal of nuclear medicine : official publication, Society of Nuclear Medicine ",2024-05-06,65,1,,10.2967/jnumed.123.266830,38719240,https://jnm.snmjournals.org/content/65/Supplement_1/12S,,,
RE00562,Pilot Study of Nectin-4-Targeted PET Imaging Agent 68Ga-FZ-NR-1 in Triple-Negative Breast Cancer from Bench to First-in-Human,"Journal of nuclear medicine : official publication, Society of Nuclear Medicine",2025-03-03,66,3,473-479,10.2967/jnumed.124.269024,39947908,https://jnm.snmjournals.org/content/66/3/473,,,
RE00563,Preclinical Evaluation of an Anti-Nectin-4 ImmunoPET Reagent in Tumor-Bearing Mice and Biodistribution Studies in Cynomolgus Monkeys,Molecular imaging and biology ,2016-04-27,18,5,768-75,10.1007/s11307-016-0953-x,27122234,https://link.springer.com/article/10.1007/s11307-016-0953-x,,,
RE00564,NECTIN-4 PET FOR OPTIMIZING ENFORTUMAB VEDOTIN DOSE-RESPONSE IN UROTHELIAL CARCINOMA,bioRxiv : the preprint server for biology,2024-12-25,,,,10.1101/2024.12.25.630315,39763905,https://doi.org/10.1101/2024.12.25.630315,,,
RE00565,Preclinical Evaluation of an Al18F-Radiolabeled Bicyclic Peptide Targeting Nectin-4,Molecular pharmaceutics,2024-12-09,22,1,221-228,10.1021/acs.molpharmaceut.4c00858,39651703,https://doi.org/10.1021/acs.molpharmaceut.4c00858,,,
RE00566,Effects of PEGylation on Imaging Contrast of 68Ga-Labeled Bicyclic Peptide PET Probes Targeting Nectin-4,Molecular pharmaceutics,2024-07-29,21,9,4430-4440,10.1021/acs.molpharmaceut.4c00366,39069891,https://doi.org/10.1021/acs.molpharmaceut.4c00366,,,
RE00567,Noninvasive Classification of Human Triple Negative Breast Cancer by PET Imaging with GRP78-Targeted Molecular Probe [68Ga]DOTA-VAP.,Molecular imaging and biology,2019-08-26,22,3,772-779,10.1007/s11307-019-01416-4,31452065,https://doi.org/10.1007/s11307-019-01416-4,,,
RE00568,Exploration of Bicyclic Peptide Ligands for Immune-Specific PET Imaging: Targeting Tumor PD-L1 with [18F]AlF-BCY10959,Molecular pharmaceutics,2025-05-08,22,6,3456-3467,10.1021/acs.molpharmaceut.5c00442,40340382,https://doi.org/10.1021/acs.molpharmaceut.5c00442,,,
RE00569,Exploration of Bicyclic Peptide Ligands for Immune-Specific PET Imaging: Targeting Tumor PD-L1 with [18F]AlF-BCY10959,Molecular pharmaceutics,2025-05-08,22,6,3456-3467,10.1021/acs.molpharmaceut.5c00442,40340382,https://doi.org/10.1021/acs.molpharmaceut.5c00442,,,
RE00570,225Ac/89Zr-Labeled N4MU01 Radioimmunoconjugates as Theranostics Against Nectin-4-Positive Triple-Negative Breast Cancer,"Journal of nuclear medicine : official publication, Society of Nuclear Medicine",2025-04-01,66,4,592-598,10.2967/jnumed.124.268387,39978811,https://jnm.snmjournals.org/content/66/4/592,,,
RE00572,Lutetium-177 labeled iPD-L1 as a novel immunomodulator for cancer-targeted radiotherapy,EJNMMI radiopharmacy and chemistry,2025-01-22,10,1,5,10.1186/s41181-025-00328-9,39843795,https://ejnmmipharmchem.springeropen.com/articles/10.1186/s41181-025-00328-9,,,
RE00573,Preparation and Application of a Bioorganic Nanoparticle-Enhanced PDL1-Targeted Small-Molecule Probe,ACS applied materials & interfaces,2023-06-13,15,25,30619-30629,10.1021/acsami.3c03931,37310115,https://pubs.acs.org/doi/10.1021/acsami.3c03931,,,
RE00574,Dual-Targeting of PD-L1 and Integrin αvβ3 for Preclinical PET Imaging of Cancer,Chembiochem : a European journal of chemical biology,2025-08-14,26,18,,10.1002/cbic.202500508,40811790,https://doi.org/10.1002/cbic.202500508,,,
RE00575,Synthesis and Biological Evaluation of Novel 99mTc-Tricarbonyl-Labeled Small-Molecule SPECT Tracers for PD-L1 Imaging,Journal of medicinal chemistry,2025-07-21,68,15,16018-16033,10.1021/acs.jmedchem.5c00979,40692132,https://doi.org/10.1021/acs.jmedchem.5c00979,,,
RE00576,Structure-activity relationship of 18F-labeled PD-L1-targeting small molecule ligands: impact of radiolabeling strategy on affinity and in vivo performance,EJNMMI radiopharmacy and chemistry,2025-07-01,10,1,33,10.1186/s41181-025-00359-2,40591084,https://ejnmmipharmchem.springeropen.com/articles/10.1186/s41181-025-00359-2,,,
RE00577,68Ga-NK224 PET/CT for Noninvasive Evaluation of PD-L1 Expression and Intertumor Heterogeneity: A Translational Exploratory Study,Clinical cancer research : an official journal of the American Association for Cancer Research,2025-07-15,31,14,2989-3001,10.1158/1078-0432.CCR-25-0160,40343815,https://doi.org/10.1158/1078-0432.CCR-25-0160,,,
RE00578,Synthesis and Evaluation of [18F]AlF-NOTA-iPD-L1 as a Potential Theranostic Pair for [177Lu]Lu-DOTA-iPD-L1,Pharmaceutics,2025-07-16,17,7,920,10.3390/pharmaceutics17070920,40733128,https://doi.org/10.3390/pharmaceutics17070920,,,
RE00579,Preclinical and first‑in‑human evaluation of [68Ga]Ga-DOTA-PEG2-Asp2-PDL1P PET imaging to assess tumor PD-L1 expression, European journal of nuclear medicine and molecular imaging,2025-03-03,52,9,3278-3290,10.1007/s00259-025-07173-7,40029371,https://link.springer.com/article/10.1007/s00259-025-07173-7,,,
RE00580,Synthesis and preclinical evaluation of a novel molecular probe [18F]AlF-NOTA-PEG2-Asp2-PDL1P for PET imaging of PD-L1 positive tumor,Bioorganic chemistry,2024-02-21,145,,107193,10.1016/j.bioorg.2024.107193,38442611,https://doi.org/10.1016/j.bioorg.2024.107193,,,
RE00581,In Vivo Evaluation and Dosimetry Estimate for a High Affinity Affibody PET Tracer Targeting PD-L1,Molecular imaging and biology,2020-10-23,23,2,241-249,10.1007/s11307-020-01544-2,33098025,https://link.springer.com/article/10.1007/s11307-020-01544-2,,,
RE00582,[18F]AlF-NOTA-PCP2: a novel PET/CT tracer for enhanced PD-L1 heterogeneity imaging and comparative analysis with [18F]AlF-NOTA-WL12 in glioblastoma xenografts,European journal of nuclear medicine and molecular imaging,2024-05-07,51,11,3161-3175,10.1007/s00259-024-06743-5,38713298,https://link.springer.com/article/10.1007/s00259-024-06743-5,,,
RE00583,Preclinical evaluation and preliminary clinical study of 68Ga-NODAGA-NM-01 for PET imaging of PD-L1 expression,Cancer imaging : the official publication of the International Cancer Imaging Society,2025-01-27,25,1,6,10.1186/s40644-025-00826-8,39871394,https://cancerimagingjournal.biomedcentral.com/articles/10.1186/s40644-025-00826-8,,,
RE00584,Assessment of PD-L1 Expression in Non-Small Cell Lung Cancers Using [68Ga]Ga-DOTA-WL12 PET/CT,Small methods,2024-06-16,8,12,e2400358,10.1002/smtd.202400358,38880776,https://doi.org/10.1002/smtd.202400358,,,
RE00585,Preclinical development of novel PD-L1 tracers and first-in-human study of [68Ga]Ga-NOTA-RW102 in patients with lung cancers, Journal for immunotherapy of cancer,2024-04-05,12,4,e008794,10.1136/jitc-2024-008794,38580333,https://jitc.bmj.com/content/12/4/e008794,,,
RE00586,Preclinical evaluation of [211At]At-AuNP-ABDMPL16 for targeted alpha therapy in Melanoma,European journal of nuclear medicine and molecular imaging,2025-05-20,52,12,4497-4510,10.1007/s00259-025-07238-7,40394402,https://link.springer.com/article/10.1007/s00259-025-07238-7,,,
RE00587,Synthesis and biological evaluation of Al[18F]-NOTA-IPB-PDL1P as a molecular probe for PET imaging of PD-L1 positive tumors,Bioorganic chemistry,2022-02-26,122,,105682,10.1016/j.bioorg.2022.105682,35278777,https://doi.org/10.1016/j.bioorg.2022.105682,,,
RE00588,Comparative study of [18F]AlF-PAI-PDL1p and [68Ga]Ga-PAI-PDL1p as novel PD-L1 targeting PET probes for tumor imaging,Bioorganic chemistry,2024-07-25,151,,107660,10.1016/j.bioorg.2024.107660,39079391,https://doi.org/10.1016/j.bioorg.2024.107660,,,
RE00589,Development of novel peptide-based radiotracers for detecting PD-L1 expression and guiding cancer immunotherapy,European journal of nuclear medicine and molecular imaging,2023-10-25,51,3,625-640,10.1007/s00259-023-06480-1,37878029,https://link.springer.com/article/10.1007/s00259-023-06480-1,,,
RE00590,First-in-Humans Evaluation of a PD-L1-Binding Peptide PET Radiotracer in Non-Small Cell Lung Cancer Patients,"Journal of nuclear medicine : official publication, Society of Nuclear Medicine",2021-07-29,63,4,536-542,10.2967/jnumed.121.262045,34326125,https://doi.org/10.2967/jnumed.121.262045,,,
RE00591,Head-to-head comparison of peptide-based and nanobody-based radiotracers in detecting PD-L1 expression in non-small cell lung cancer,European journal of nuclear medicine and molecular imaging,2025-05-08,52,12,4477-4486,10.1007/s00259-025-07316-w,40338301,https://link.springer.com/article/10.1007/s00259-025-07316-w,,,
RE00592,Synthesis and preclinical evaluation of a novel probe [18F]AlF-NOTA-IPB-GPC3P for PET imaging of GPC3 positive tumor,Bioorganic chemistry,2024-04-14,147,,107352,10.1016/j.bioorg.2024.107352,38640719,https://doi.org/10.1016/j.bioorg.2024.107352,,,
RE00594,Synthesis and In Vitro Evaluation of a Scandium-44 Radiolabeled Nanobody as a PD-L1 PET Imaging Probe,Pharmaceutics,2025-04-08,17,6,796,10.3390/pharmaceutics17060796,40574107,https://doi.org/10.3390/pharmaceutics17060796,,,
RE00595,In Vivo Imaging of the Programmed Death Ligand 1 by 18F PET,"Journal of nuclear medicine : official publication, Society of Nuclear Medicine",2017-06-06,58,11,1852-1857,10.2967/jnumed.117.191718,28588151,https://doi.org/10.2967/jnumed.117.191718,,,
RE00597,"Synthesis and Preclinical Evaluation of a 68Ga-Labeled Adnectin, 68Ga-BMS-986192, as a PET Agent for Imaging PD-L1 Expression","Journal of nuclear medicine : official publication, Society of Nuclear Medicine",2021-01-30,62,9,1228-1234,10.2967/jnumed.120.258384,33517324,https://doi.org/10.2967/jnumed.120.258384,,,
RE00598,Molecular Imaging of PD-L1 Expression and Dynamics with the Adnectin-Based PET Tracer 18F-BMS-986192,"Journal of nuclear medicine : official publication, Society of Nuclear Medicine",2020-05-01,61,12,1839-1844,10.2967/jnumed.119.241364,32358092,https://doi.org/10.2967/jnumed.119.241364,,,
RE00599,"Development, Characterization, and Radiation Dosimetry Studies of 18F-BMS-986229, a 18F-Labeled PD-L1 Macrocyclic Peptide PET Tracer",Molecular imaging and biology,2023-12-20,26,2,301-309,10.1007/s11307-023-01889-4,38123744,https://link.springer.com/article/10.1007/s11307-023-01889-4,,,
RE00600,"The discovery and evaluation of [18F]BMS-986229, a novel macrocyclic peptide PET radioligand for the measurement of PD-L1 expression and in-vivo PD-L1 target engagement",European journal of nuclear medicine and molecular imaging,2023-12-05,51,4,978-990,10.1007/s00259-023-06527-3,38049658,https://link.springer.com/article/10.1007/s00259-023-06527-3,,,
RE00601,"Side by side comparison of NOTA and DOTA for conjugation efficiency, gallium-68 labeling, and in vivo biodistribution of anti-mesothelin sdAb A1-His",EJNMMI radiopharmacy and chemistry,2025-08-20,10,1,54,10.1186/s41181-025-00380-5,40833585,https://ejnmmipharmchem.springeropen.com/articles/10.1186/s41181-025-00380-5,,,
RE00602,Chelator impact: investigating the pharmacokinetic behavior of copper-64 labeled PD-L1 radioligands,EJNMMI radiopharmacy and chemistry,2024-03-19,9,1,14,10.1186/s41181-024-00243-5,38372838,https://ejnmmipharmchem.springeropen.com/articles,,,
RE00603,Linear Peptide-Based PET Tracers for Imaging PD-L1 in Tumors,Molecular pharmaceutics,2023-06-27,20,8,4256-4257,10.1021/acs.molpharmaceut.3c00382,37368947,https://doi.org/10.1021/acs.molpharmaceut.3c00382,,,
RE00604,Sensitive Positron Emission Tomography Imaging of PD-L1 Expression in Human Breast and Lung Carcinoma Xenografts Using the Radiometalated Peptide Ga-68-TRAP-WL12,Molecular pharmaceutics,2024-01-31,21,4,1827-1837,10.1021/acs.molpharmaceut.3c01128,38291706,https://doi.org/10.1021/acs.molpharmaceut.3c01128,,,
RE00605,Peptide-Based 68Ga-PET Radiotracer for Imaging PD-L1 Expression in Cancer,Molecular pharmaceutics,2018-08-10,15,9,3946-3952,10.1021/acs.molpharmaceut.8b00399,30037229,https://doi.org/10.1021/acs.molpharmaceut.8b00399,,,
RE00606,A Novel Small Cyclic Peptide-Based 68Ga-Radiotracer for Positron Emission Tomography Imaging of PD-L1 Expression in Tumors,Molecular pharmaceutics,2021-12-15,19,1,138-147,10.1021/acs.molpharmaceut.1c00694,34910492,https://doi.org/10.1021/acs.molpharmaceut.1c00694,,,
RE00607,Noninvasive Immunotyping and Immunotherapy Monitoring of Lung Cancers via Nuclear Imaging of LAG-3 and PD-L1,"Advanced science (Weinheim, Baden-Wurttemberg, Germany)",2024-11-08,12,1,e2404231,10.1002/advs.202404231,39513410,https://doi.org/10.1002/advs.202404231,,,
RE00608,Nuclear imaging of PD-L1 expression promotes the synergistic antitumor efficacy of targeted radionuclide therapy and immune checkpoint blockade,European journal of nuclear medicine and molecular imaging,2024-10-30,52,3,955-969,10.1007/s00259-024-06962-w,39472367,https://link.springer.com/article/10.1007/s00259-024-06962-w,,,
RE00609,Noninvasive Imaging of Tumor PD-L1 Expression Using [99mTc]Tc-Labeled KN035 with SPECT/CT,Molecular pharmaceutics,2022-12-21,20,1,690-700,10.1021/acs.molpharmaceut.2c00874,36541699,https://doi.org/10.1021/acs.molpharmaceut.2c00874,,,
RE00610,Early Phase I Study of a 99mTc-Labeled Anti-Programmed Death Ligand-1 (PD-L1) Single-Domain Antibody in SPECT/CT Assessment of PD-L1 Expression in Non-Small Cell Lung Cancer,"Journal of nuclear medicine : official publication, Society of Nuclear Medicine ",2019-02-22,60,9,1213-1220,10.2967/jnumed.118.224170,30796165,https://doi.org/10.2967/jnumed.118.224170,,,
RE00611,"Inter-rater and intra-rater agreement of [99mTc]-labelled NM-01, a single-domain programmed death-ligand 1 (PD-L1) antibody, using quantitative SPECT/CT in non-small cell lung cancer",EJNMMI research,2023-05-31,13,1,51,10.1186/s13550-023-01002-4,37256434,https://ejnmmires.springeropen.com/articles/10.1186/s13550-023-01002-4,,,
RE00612,[99mTc]-labelled anti-Programmed Death-Ligand 1 single-domain antibody SPECT/CT: a novel imaging biomarker for myocardial PD-L1 expression,EJNMMI research,2023-05-17,13,1,44,10.1186/s13550-023-00990-7,37195370,https://ejnmmires.springeropen.com/articles/10.1186/s13550-023-00990-7,,,
RE00613,Noninvasive Evaluation of Tumoral PD-L1 Using a Novel 99mTc-Labeled Nanobody Tracer with Rapid Renal Clearance,Molecular pharmaceutics,2024-02-23,21,4,1977-1986,10.1021/acs.molpharmaceut.3c01219,38395797,https://doi.org/10.1021/acs.molpharmaceut.3c01219,,,
RE00614,A Pretargeted Imaging Strategy for Immune Checkpoint Ligand PD-L1 Expression in Tumor Based on Bioorthogonal Diels-Alder Click Chemistry,Molecular imaging and biology,2019-11-18,22,4,842-853,10.1007/s11307-019-01441-3,31741201,https://link.springer.com/article/10.1007/s11307-019-01441-3,,,
RE00615,Synthesis and evaluation of anti-PD-L1-B11 antibody fragments for PET imaging of PD-L1 in breast cancer and melanoma tumor models,Scientific reports,2024-08-22,14,1,19561,10.1038/s41598-024-70385-8,39174596,https://www.nature.com/articles/s41598-024-70385-8,,,
RE00616,Non-invasive immunoPET imaging of PD-L1 using anti-PD-L1-B11 in breast cancer and melanoma tumor model,Nuclear medicine and biology,2021-05-29,100-101,,,10.1016/j.nucmedbio.2021.05.004,34119742,https://doi.org/10.1016/j.nucmedbio.2021.05.004,,,
RE00617,Site-Specific Immuno-PET Tracer to Image PD-L1,Molecular pharmaceutics,2019-03-25,16,5,2028-2036,10.1021/acs.molpharmaceut.9b00010,30875232,https://doi.org/10.1021/acs.molpharmaceut.9b00010,,,
