reference_id,title,journal,publication_date,volume,issue,pages,doi,pmid,url,notes,created_at,updated_at
RE01224,Rejection in a Canine Presensitization Model Anti-CD45 Radioimmunotherapy with 90Y but Not 177Lu Is Effective Treatment in a Syngeneic Murine Leukemia Model,PLOS ONE,2014-12-02,,,,10.1371/journal.pone.0113601,,https://doi.org/10.1371/journal.pone.0113601,,,
RE01225,Anti-CD45 Pretargeted Radioimmunotherapy in a Nonhuman Primate Model.,LYMPHOMA: PRE-CLINICAL - CHEMOTHERAPY AND BIOLOGIC AGENTS,2005-06-29,110,11,2336,10.1182/blood.V110.11.2336.2336,,https://doi.org/10.1182/blood.V110.11.2336.2336,,,
RE01226,Anti-CD45 Monoclonal Antibody (MAb) Dose Optimization For Astatine-211 (211At)-Radioimmunotherapy (RIT) Of Relapsed Non-Hodgkin Lymphoma (NHL) In a Canine Model,LYMPHOMA: PRE-CLINICAL – CHEMOTHERAPY AND BIOLOGIC AGENTS,2005-07-05,122,11,5139,10.1182/blood.V122.21.5139.5139,,https://doi.org/10.1182/blood.V122.21.5139.5139,,,
RE01227,Donor Engraftment Following α-Emitter Astatine-211 (211At) Labeled Anti-CD45 Monoclonal Antibody (mAb) Nonmyeloablative Conditioning for Dog Leukocyte Antigen (DLA)-Identical Marrow Transplantation,"EXPERIMENTAL TRANSPLANTATION - BASIC BIOLOGY, IMMUNE FUNCTION AND ENGRAFTMENT: NON-MYELOABLATIVE CONDITIONING AND IMMUNE MECHANISMS IN HEMATOPOIETIC ENGRAFTMENT",2005-07-02,116,21,76,10.1182/blood.V116.21.76.76,,https://doi.org/10.1182/blood.V116.21.76.76,,,
RE01228,Combination treatment of VLA-4 targeted radionuclide therapy and immunotherapy in a mouse model of melanoma,Journal of Nuclear Medicine,2018-06-30,,,,10.2967/jnumed.118.209510,,https://doi.org/10.2967/jnumed.118.209510,,,
RE01229,Radiolabeling Human Peripheral Blood Stem Cells for Positron Emission Tomography (PET) Imaging in Young Rhesus Monkeys,PLOS ONE,2026-10-13,8,10,e77148,10.1371/journal.pone.0077148,,https://doi.org/10.1371/journal.pone.0077148,,,
RE01230,Radioimmunotherapy for the Intensification of Conditioning Before Stem Cell Transplantation: Differences in Dosimetry and Biokinetics of 188Re-and 99mTc@LabeledAnti NCA-.95MAbs,THEJOURNALOFNUCLEARMEDICIN,2000-03-01,41,3,531-537,,,https://doi.org/,,,
RE01231,In Vivo Localization of 90Yand 177Lu Radioimmunoconjugates Using Cerenkov Luminescence Imaging in a Disseminated Murine Leukemia Model,"Therapeutics, Targets, and Chemical Biology",2014-10-15,74,20,5846-5854,10.1158/0008-5472.CAN-14-0764,,https://doi.org/10.1158/0008-5472.CAN-14-0764,,,
RE01232,Evaluation of 99mTc-rhAnnexin V-128 SPECT/CT as a diagnostic tool for early stages of interstitial lung disease associated with systemic sclerosis,Schniering et al. Arthritis Research & Therapy,2005-07-10,20,183,,10.1186/s13075-018-1681-1,,https://doi.org/10.1186/s13075-018-1681-1,,,
RE01233,Reagents for Astatination of Biomolecules. 6. An Intact Antibody Conjugated with a Maleimido-closo-Decaborate(2-) Reagent via Sulfhydryl Groups Had Considerably Higher Kidney Concentrations than the Same Antibody Conjugated with an Isothiocyanato-closo-Decaborate(2-) Reagent via Lysine Amines,Bioconjugate Chemistry,2012-02-01,23,,409−420, 10.14694/EdBook_AM.2014.34.e126,,https://doi.org/ 10.14694/EdBook_AM.2014.34.e126,,,
RE01234,Sequential Cytarabine and α-Particle Immunotherapy with Bismuth-213–Lintuzumab (HuM195) for Acute Myeloid Leukemia,Cancer Therapy: Clinical,2010-09-21,16,21,5303-5311, 10.1158/1078-0432.CCR-10-0382,,https://doi.org/ 10.1158/1078-0432.CCR-10-0382,,,
RE01235,Phase I Trial of the Targeted Alpha-Particle Nano-Generator Actinium-225 (225Ac)-Lintuzumab (Anti-CD33; HuM195) in Acute Myeloid Leukemia (AML),"ACUTE MYELOID LEUKEMIA - THERAPY, EXCLUDING TRANSPLANTATION: CLINICAL STUDIES",2011-11-18,18,21,768,10.1158/1078-0432.CCR-21-3712,,https://doi.org/10.1158/1078-0432.CCR-21-3712,,,
RE01236,"Myeloablative Radioimmunotherapy with Re-188-anti-CD66-Antibody for Conditioning of High-Risk Leukemia Patients Prior to Stem Cell Transplantation: Biodistribution, Biokinetics and Immediate Toxicities",CANCER BIOTHERAPY & RADIOPHARMACEUTICALS,2005-06-24,17,2,151-163,10.1089/108497802753773775,,https://doi.org/10.1089/108497802753773775,,,
RE01237,DOTA conjugate with an albumin-binding entity enables the first folic acid-targeted 177Lu-radionuclide tumor therapy in mice,"Journal of nuclear medicine : official publication, Society of Nuclear Medicine",2012-12-12,54,1,124-31,10.2967/jnumed.112.107235,23236020,https://doi.org/10.2967/jnumed.112.107235,,,
RE01238,A visual scale to rate amygdalar atrophy on MRI,European radiology,2024-12-19,35,7,4246-4256,10.2967/jnumed.102.046814,39699678,https://doi.org/10.2967/jnumed.102.046814,,,
RE01239,"Imaging the folate receptor on cancer cells with 99mTc-etarfolatide: properties, clinical use, and future potential of folate receptor imaging","Journal of nuclear medicine : official publication, Society of Nuclear Medicine",2014-04-14,55,5,701-4,10.2967/jnumed.113.133074,24732155,https://doi.org/10.2967/jnumed.113.133074,,,
RE01240,Exploratory study of 99mTc-EC20 imaging for identifying patients with folate receptor-positive solid tumors,"Journal of nuclear medicine : official publication, Society of Nuclear Medicine",2008-05-15,49,6,899-906,10.2967/jnumed.107.049478,18483093,https://doi.org/10.2967/jnumed.107.049478,,,
RE01241,Identification of a PET Radiotracer for Imaging of the Folate Receptor-α: A Potential Tool to Select Patients for Targeted Tumor Therapy,"Journal of nuclear medicine : official publication, Society of Nuclear Medicine",2021-01-15,62,10,1475-1481,10.2967/jnumed.120.255760,33452043,https://doi.org/10.2967/jnumed.120.255760,,,
RE01242,Promising prospects for 44Sc-/47Sc-based theragnostics: application of 47Sc for radionuclide tumor therapy in mice,"Journal of nuclear medicine : official publication, Society of Nuclear Medicine",2014-07-17,55,10,1658-64,10.2967/jnumed.114.141614,25034091,https://doi.org/10.2967/jnumed.114.141614,,,
RE01243,A unique matched quadruplet of terbium radioisotopes for PET and SPECT and for α- and β- radionuclide therapy: an in vivo proof-of-concept study with a new receptor-targeted folate derivative,"Journal of nuclear medicine : official publication, Society of Nuclear Medicine",2012-11-08,53,12,,10.2967/jnumed.112.107540,23139086,https://doi.org/10.2967/jnumed.112.107540,,,
RE01244,177Lu-EC0800 combined with the antifolate pemetrexed: preclinical pilot study of folate receptor targeted radionuclide tumor therapy,Molecular cancer therapeutics,2013-09-12,12,11,2436-45,10.1158/1535-7163.MCT-13-0422-T,24030631,https://doi.org/10.1158/1535-7163.MCT-13-0422-T,,,
RE01245,Development of a Novel 99mTc-Labeled Folate Derivative Containing Phenyl Isonitrile to Target Folate Receptor with Reduced Renal Uptake,Molecular pharmaceutics,2024-10-24,21,11,5681-5689,10.1021/acs.molpharmaceut.4c00667,39445478,https://doi.org/10.1021/acs.molpharmaceut.4c00667,,,
RE01246,Novel Synthetic Strategies Enable the Efficient Development of Folate Conjugates for Cancer Radiotheranostics,Bioconjugate chemistry,2021-07-12,32,8,1617-1628,10.1021/acs.bioconjchem.1c00198,34251183,https://doi.org/10.1021/acs.bioconjchem.1c00198,,,
RE01247,Synthesis and Preclinical Evaluation of Novel 99mTc-Labeled FR-Targeting Agents with Satisfactory Imaging Contrast and Reduced Renal Uptake,Journal of medicinal chemistry,2025-02-21,68,5,6575-5686,10.1021/acs.jmedchem.4c02932,39982495,https://doi.org/10.1021/acs.jmedchem.4c02932,,,
RE01248,Folate-PEG-NOTA-Al18F: A New Folate Based Radiotracer for PET Imaging of Folate Receptor-Positive Tumors,Molecular pharmaceutics,2017-11-01,14,12,4353-4361,10.1021/acs.molpharmaceut.7b00415,29028357,https://doi.org/10.1021/acs.molpharmaceut.7b00415,,,
RE01249,Preclinical Comparison of Albumin-Binding Radiofolates: Impact of Linker Entities on the in Vitro and in Vivo Properties,Molecular pharmaceutics,2017-01-17,14,2,523-532,10.1021/acs.molpharmaceut.6b01010,28094532,https://doi.org/10.1021/acs.molpharmaceut.6b01010,,,
RE01250,(64)Cu- and (68)Ga-Based PET Imaging of Folate Receptor-Positive Tumors: Development and Evaluation of an Albumin-Binding NODAGA-Folate,Molecular pharmaceutics,2016-05-04,13,6,1979-87,10.1021/acs.molpharmaceut.6b00143,27145400,https://doi.org/10.1021/acs.molpharmaceut.6b00143,,,
RE01251,"""Click-to-chelate"": in vitro and in vivo comparison of a 99mTc(CO)3-labeled N(tau)-histidine folate derivative with its isostructural, clicked 1,2,3-triazole analogue",Bioconjugate chemistry,2008-07-23,19,8,1689-95,10.1021/bc800183r,18646835,https://doi.org/10.1021/bc800183r,,,
RE01252,Radiosynthesis and preclinical evaluation of 3'-Aza-2'-[(18)F]fluorofolic acid: a novel PET radiotracer for folate receptor targeting,Bioconjugate chemistry,2013-01-17,24,2,205-14,10.1021/bc300483a,,https://doi.org/10.1021/bc300483a,,,
RE01254,Folate receptor-targeted radionuclide therapy: preclinical investigation of anti-tumor effects and potential radionephropathy,Nuclear medicine and biology,2015-06-11,42,10,770-9,10.1016/j.nucmedbio.2015.06.006,26162583,https://doi.org/10.1016/j.nucmedbio.2015.06.006,,,
RE01255,Radiosynthesis and micro-SPECT imaging of 99mTc-dendrimer poly(amido)-amine folic acid conjugate,Bioorganic & medicinal chemistry letters,2009-12-24,20,3,927-31,10.1016/j.bmcl.2009.12.075,20045643,https://doi.org/10.1016/j.bmcl.2009.12.075,,,
RE01256,Tumor targeting using 67Ga-DOTA-Bz-folate--investigations of methods to improve the tissue distribution of radiofolates,Nuclear medicine and biology,2011-03-03,38,5,715-23,10.1016/j.nucmedbio.2010.12.013,21718947,https://doi.org/10.1016/j.nucmedbio.2010.12.013,,,
RE01257,177Lu-EC0800 combined with the antifolate pemetrexed: preclinical pilot study of folate receptor targeted radionuclide tumor therapy,Molecular cancer therapeutics,2013-09-12,12,11,2436-45,10.1158/1535-7163.MCT-13-0422-T,24030631,https://doi.org/10.1158/1535-7163.MCT-13-0422-T,,,
RE01259,Radiosynthesis and micro-SPECT imaging of 99mTc-dendrimer poly(amido)-amine folic acid conjugate,Bioorganic & medicinal chemistry letters,2009-12-24,20,3,927-31,10.1016/j.bmcl.2009.12.075,20045643,https://doi.org/10.1016/j.bmcl.2009.12.075,,,
RE01260,Design and synthesis of 99mTc-citro-folate for use as a tumor-targeted radiopharmaceutical,International journal of pharmaceutics,2010-08-07,400,,,10.1016/j.ijpharm.2010.08.002,20696224,https://doi.org/10.1016/j.ijpharm.2010.08.002,,,
RE01261,Gadolinium-tetraazacyclododecane tetraacetic acid coupled with folate via bis(aminoethyl)ethylene glycol linker,Molecular Imaging and Contrast Agent Database (MICAD),2001-04-19,,,,,21542552,,,,
RE01262,Development of new folate-based PET radiotracers: preclinical evaluation of ⁶⁸Ga-DOTA-folate conjugates,European journal of nuclear medicine and molecular imaging,2010-08-27,38,1,108-19,10.1007/s00259-010-1597-8,20799032,https://doi.org/10.1007/s00259-010-1597-8,,,
RE01264,In vivo imaging of folate receptor positive tumor xenografts using novel 68Ga-NODAGA-folate conjugates,Molecular pharmaceutics,2012-04-23,9,5,1136-45,10.1021/mp200418f,22497506,https://doi.org/10.1021/mp200418f,,,
RE01265,In vitro and in vivo evaluation of (99m)Tc-DO3A-EA-Folate for receptor-mediated targeting of folate positive tumors,Journal of drug targeting,2011-03-22,19,9,761-9, 10.3109/1061186X.2011.561857,22497506,https://doi.org/ 10.3109/1061186X.2011.561857,,,
RE01266,Synthesis and Preclinical Evaluation of Folate-NOTA-Al(18)F for PET Imaging of Folate-Receptor-Positive Tumors,Molecular pharmaceutics,2016-04-18,13,5,1520-7,10.1021/acs.molpharmaceut.5b00989,27054811,https://doi.org/10.1021/acs.molpharmaceut.5b00989,,,
RE01267,Peptide-Based [68Ga]Ga Labeled PET Tracer for Tumor Imaging by Targeting Tumor-Associated Macrophages,Pharmaceutics,2022-11-18,14,11,2511,10.3390/pharmaceutics14112511,,https://doi.org/10.3390/pharmaceutics14112511,,,
RE01268,Preclinical evaluation of 5-methyltetrahydrofolate-based radioconjugates-new perspectives for folate receptor-targeted radionuclide therapy,European journal of nuclear medicine and molecular imaging,2020-10-15,48,4,972-983,10.1007/s00259-020-04980-y,33063250,https://doi.org/10.1007/s00259-020-04980-y,,,
RE01269,The Effect of Governmental Health Measures on Public Behaviour During the COVID-19 Pandemic Outbreak,International journal of health policy and management,2021-09-11,11,10,2166-2174,34814663, 10.34172/ijhpm.2021.131,https://doi.org/10.34172/ijhpm.2021.131,,,
RE01270,Development of New CD38 Targeted Peptides for Cancer Imaging,Molecular imaging and biology,2024-03-13,26,4,738-753,10.1007/s11307-024-01901-5,38480650,https://doi.org/10.1007/s11307-024-01901-5,,,
RE01271,CD38 as a PET imaging target in lung cancer,,2017-06-02,,,,10.1021/acs.molpharmaceut.7b00357,28573863,https://doi.org/10.1021/acs.molpharmaceut.7b00357,,,
RE01272,CD38 as a PET imaging target in lung cancer,,2017-06-02,,,,10.1021/acs.molpharmaceut.7b00357,28573863,https://doi.org/10.1021/acs.molpharmaceut.7b00357,,,
RE01273,CD38-Specific Gallium-68 Labeled Peptide Radiotracer Enables Pharmacodynamic Monitoring in Multiple Myeloma with PET,"Advanced science (Weinheim, Baden-Wurttemberg, Germany)",2024-02-29,11,16,e2308617,10.1002/advs.202308617,38421139,https://doi.org/10.1002/advs.202308617,,,
RE01274,99mTc-CD3813: A Nanobody-Based Single Photon Emission Computed Tomography Radiotracer with Clinical Potential for Myeloma Imaging and Evaluation of CD38 Expression,Molecular pharmaceutics,2022-06-13,19,7,2583-2594,10.1021/acs.molpharmaceut.2c00279,35696536,https://doi.org/10.1021/acs.molpharmaceut.2c00279,,,
RE01275,ImmunoPET imaging of CD38 in murine lymphoma models using 89Zr-labeled daratumumab,European journal of nuclear medicine and molecular imaging,2018-02-15,45,8,1372-1381,10.1007/s00259-018-3941-3,29450576,https://doi.org/10.1007/s00259-018-3941-3,,,
RE01276,CD38-Targeted Theranostics of Lymphoma with 89Zr/177Lu-Labeled Daratumumab,"Advanced science (Weinheim, Baden-Wurttemberg, Germany)",2021-05-15,8,10,2001879,10.1002/advs.202001879,34026426,https://doi.org/10.1002/advs.202001879,,,
RE01277,Preclinical Development of CD38-Targeted [89Zr]Zr-DFO-Daratumumab for Imaging Multiple Myeloma,"Journal of nuclear medicine : official publication, Society of Nuclear Medicine",2017-10-12,59,2,216-222,10.2967/jnumed.117.196063,,https://doi.org/10.2967/jnumed.117.196063,,,
RE01278,Pharmacokinetic Positron Emission Tomography Imaging of an Optimized CD38-Targeted 68Ga-Labeled Peptide in Multiple Myeloma: A Pilot Study,Bioconjugate chemistry,2024-11-14,35,12,1985-1996,10.1021/acs.bioconjchem.4c00497,39540871,https://doi.org/10.1021/acs.bioconjchem.4c00497,,,
RE01279,Comparison of CD38-Targeted α- Versus β-Radionuclide Therapy of Disseminated Multiple Myeloma in an Animal Model,"Journal of nuclear medicine : official publication, Society of Nuclear Medicine",2020-10-30,62,6,795-801,10.2967/jnumed.120.251983,33127621,https://doi.org/10.2967/jnumed.120.251983,,,
RE01280,CD38-targeted Immuno-PET of Multiple Myeloma: From Xenograft Models to First-in-Human Imaging,Radiology,2020-04-07,295,3,606-615,10.1148/radiol.2020192621,32255416,https://doi.org/10.1148/radiol.2020192621,,,
RE01281,64Cu-labeled daratumumab F(ab')2 fragment enables early visualization of CD38-positive lymphoma,European journal of nuclear medicine and molecular imaging,2021-10-22,49,5,1470-1481,10.1007/s00259-021-05593-9,34677626,https://doi.org/10.1007/s00259-021-05593-9,,,
RE01282,Identifying CD38+ cells in patients with multiple myeloma: first-in-human imaging using copper-64-labeled daratumumab,Blood advances,2020-10-27,4,20,5194-5202,10.1182/bloodadvances.2020002603,33095874,https://doi.org/10.1182/bloodadvances.2020002603,,,
RE01283,The α-emitter astatine-211 targeted to CD38 can eradicate multiple myeloma in a disseminated disease model,Blood,2019-10-10,134,15,1247-1256,10.1182/blood.2019001250,31395601,https://doi.org/10.1182/blood.2019001250,,,
RE01284,Copper 64-labeled daratumumab as a PET/CT imaging tracer for multiple myeloma,Blood,2018-01-04,131,7,741-745,10.1182/blood-2017-09-807263,29301755,https://doi.org/10.1182/blood-2017-09-807263,,,
RE01285,Daratumumab-225Actinium conjugate demonstrates greatly enhanced antitumor activity against experimental multiple myeloma tumors,Oncoimmunology,2019-05-01,8,8,1607673,10.1080/2162402X.2019.1607673,31413916,https://doi.org/10.1080/2162402X.2019.1607673,,,
RE01286,ImmunoPET imaging of multiple myeloma with [68Ga]Ga-NOTA-Nb1053,European journal of nuclear medicine and molecular imaging,2021-02-05,48,9,2749-2760,10.1007/s00259-021-05218-1,,https://doi.org/10.1007/s00259-021-05218-1,,,
RE01287,First-in-Humans Evaluation of Safety and Dosimetry of 64Cu-LLP2A for PET Imaging,"Journal of nuclear medicine : official publication, Society of Nuclear Medicine ",2022-08-25,64,2,320-328,10.2967/jnumed.122.264349,36008121,https://doi.org/10.2967/jnumed.122.264349,,,
RE01288,Ex Vivo and In Vivo Evaluation of Overexpressed VLA-4 in Multiple Myeloma Using LLP2A Imaging Agents,"Journal of nuclear medicine : official publication, Society of Nuclear Medicine",2016-01-07,57,4,640-5,10.2967/jnumed.115.164624,26742713,https://doi.org/10.2967/jnumed.115.164624,,,
RE01289,PET imaging of very late antigen-4 in melanoma: comparison of 68Ga- and 64Cu-labeled NODAGA and CB-TE1A1P-LLP2A conjugates,"Journal of nuclear medicine : official publication, Society of Nuclear Medicine",2014-09-25,55,11,1856-63,10.2967/jnumed.114.144881,25256059,https://doi.org/10.2967/jnumed.114.144881,,,
RE01290,Evaluation of (68)Ga- and (177)Lu-DOTA-PEG4-LLP2A for VLA-4-Targeted PET Imaging and Treatment of Metastatic Melanoma,Molecular pharmaceutics,2015-05-08,12,6,1929-38,10.1021/mp5006917,25919487,https://doi.org/10.1021/mp5006917,,,
RE01291,Albumin-Binding Lutetium-177-Labeled LLP2A Derivatives as Theranostics for Melanoma,Molecular pharmaceutics,2024-04-29,21,6,2960-2969,10.1021/acs.molpharmaceut.4c00095,38680059,https://doi.org/10.1021/acs.molpharmaceut.4c00095,,,
RE01292,Effect of Click Chemistry Linkages on the Biological Behavior of Albumin-Binding 177Lu-DOTAGA-pIBA-LLP2A Analogues Targeting Melanoma,Bioconjugate chemistry,2025-08-15,36,9,2002-2012,10.1021/acs.bioconjchem.5c00277,40815685,https://doi.org/10.1021/acs.bioconjchem.5c00277,,,
RE01293,"Comparison of two cross-bridged macrocyclic chelators for the evaluation of 64Cu-labeled-LLP2A, a peptidomimetic ligand targeting VLA-4-positive tumors",Nuclear medicine and biology,2012-12-23,40,2,245-51,10.1016/j.nucmedbio.2012.10.010,23265977,https://doi.org/10.1016/j.nucmedbio.2012.10.010,,,
RE01294,Comparison of Al18F- and 68Ga-labeled NOTA-PEG4-LLP2A for PET imaging of very late antigen-4 in melanoma,Journal of biological inorganic chemistry : JBIC : a publication of the Society of Biological Inorganic Chemistry,2019-11-19,25,1,99-108,10.1007/s00775-019-01742-6,31745667,https://doi.org/10.1007/s00775-019-01742-6,,,
RE01295,"CD8-Targeted PET Imaging of Tumor-Infiltrating T Cells in Patients with Cancer: A Phase I First-in-Humans Study of 89Zr-Df-IAB22M2C, a Radiolabeled Anti-CD8 Minibody","Journal of nuclear medicine : official publication, Society of Nuclear Medicine",2026-05-22,63,5,720-726,10.2967/jnumed.121.262485,34413145,https://doi.org/10.2967/jnumed.121.262485,,,
RE01296,Evaluation of a Radio-IMmunoStimulant (RIMS) in a Syngeneic Model of Murine Prostate Cancer and ImmunoPET Analysis of T-cell Distribution,Molecular pharmaceutics,2022-07-27,19,9,3217-3227,10.1021/acs.molpharmaceut.2c00361,35895995,https://doi.org/10.1021/acs.molpharmaceut.2c00361,,,
RE01297,Whole-body CD8+ T cell visualization before and during cancer immunotherapy: a phase 1/2 trial,Nature medicine,2022-12-05,28,12,2601-2610,10.1038/s41591-022-02084-8,36471036,https://doi.org/10.1038/s41591-022-02084-8,,,
RE01299,In vivo imaging of CD8+ T cells in metastatic cancer patients: first clinical experience with simultaneous [89Zr]Zr-Df-IAB22M2C PET/MRI,Theranostics,2023-04-17,13,8,2408-2423,10.7150/thno.79976,,https://doi.org/10.7150/thno.79976,,,
RE01300,CS1-specific single-domain antibodies labeled with Actinium-225 prolong survival and increase CD8+ T cells and PD-L1 expression in Multiple Myeloma,Oncoimmunology,2021-11-09,10,1,2000699,10.1080/2162402x.2021.2000699,34777918,https://doi.org/10.1080/2162402x.2021.2000699,,,
RE01301,The Biodistribution of a CD3 and EpCAM Bispecific T-Cell Engager Is Driven by the CD3 Arm,"Journal of nuclear medicine : official publication, Society of Nuclear Medicine",2020-04-13,61,11,1594-1601,10.2967/jnumed.120.241877,32284393,https://doi.org/10.2967/jnumed.120.241877,,,
RE01302,Longitudinal evaluation of the biodistribution and cellular internalization of the bispecific CD3xTRP1 antibody in syngeneic mouse tumor models,Journal for immunotherapy of cancer,2023-10-29,11,10,e007596,10.1136/jitc-2023-007596,37899133,https://doi.org/10.1136/jitc-2023-007596,,,
RE01303,Molecular Imaging of B7-H3-Targeting Bispecific T Cell-Engaging Antibody MGD009 in Glioblastoma Models,ACS applied materials & interfaces,2025-04-04,17,15,22384-22393,10.1021/acsami.5c01451,40183579,https://doi.org/10.1021/acsami.5c01451,,,
RE01304,99mTc-A1 as a Novel Imaging Agent Targeting Mesothelin-Expressing Pancreatic Ductal Adenocarcinoma,Cancers,2019-10-10,11,10,1531,10.3390/cancers11101531,31658755,https://doi.org/10.3390/cancers11101531,,,
RE01305,Immuno-PET imaging of tumor-infiltrating lymphocytes using zirconium-89 radiolabeled anti-CD3 antibody in immune-competent mice bearing syngeneic tumors,PloS one,2018-03-07,13,3,e0193832,10.1371/journal.pone.0193832,29513764,https://doi.org/10.1371/journal.pone.0193832,,,
RE01306,Preclinical radioimmunotargeting of folate receptor alpha using the monoclonal antibody conjugate DOTA-MORAb-003,Nuclear medicine and biology,2026-04-08,35,3,343-51,10.1016/j.nucmedbio.2007.12.008,18355690,https://doi.org/10.1016/j.nucmedbio.2007.12.008,,,
RE01307,"Effect of chelator conjugation level and injection dose on tumor and organ uptake of 111In-labeled MORAb-009, an anti-mesothelin antibody",Nuclear medicine and biology,2011-07-07,38,8,1119-27,10.1016/j.nucmedbio.2011.05.003,21741258,https://doi.org/10.1016/j.nucmedbio.2011.05.003,,,
RE01308,"Tumor and organ uptake of (64)Cu-labeled MORAb-009 (amatuximab), an anti-mesothelin antibody, by PET imaging and biodistribution studies",Nuclear medicine and biology,2015-07-29,42,11,880-6,10.1016/j.nucmedbio.2015.07.008,26307499,https://doi.org/10.1016/j.nucmedbio.2015.07.008,,,
RE01309,Radiolabeled humanized anti-CD3 monoclonal antibody visilizumab for imaging human T-lymphocytes,"Journal of nuclear medicine : official publication, Society of Nuclear Medicine",2009-09-16,50,10,1683,10.2967/jnumed.108.059485,19759100,https://doi.org/10.2967/jnumed.108.059485,,,
RE01310,"First-in-Humans Imaging with 89Zr-Df-IAB22M2C Anti-CD8 Minibody in Patients with Solid Malignancies: Preliminary Pharmacokinetics, Biodistribution, and Lesion Targeting","Journal of nuclear medicine : official publication, Society of Nuclear Medicine",2019-10-04,61,4,512-519,10.2967/jnumed.119.229781,31586002,https://doi.org/10.2967/jnumed.119.229781,,,
RE01311,Imaging the distribution of an antibody-drug conjugate constituent targeting mesothelin with ⁸⁹Zr and IRDye 800CW in mice bearing human pancreatic tumor xenografts,Oncotarget,2015-12-08,6,39,42081-90,10.18632/oncotarget.5877,26536664,https://doi.org/10.18632/oncotarget.5877,,,
RE01312,Preclinical Evaluation of 89Zr-Df-IAB22M2C PET as an Imaging Biomarker for the Development of the GUCY2C-CD3 Bispecific PF-07062119 as a T Cell Engaging Therapy,Molecular imaging and biology,2021-06-18,23,6,941-951,10.1007/s11307-021-01621-0,34143379,https://doi.org/10.1007/s11307-021-01621-0,,,
RE01313,Comparison of a tetravalent single-chain antibody-streptavidin fusion protein and an antibody-streptavidin chemical conjugate for pretargeted anti-CD20 radioimmunotherapy of B-cell lymphomas,Blood,2006-07-01,108,1,328-36,10.1182/blood-2005-11-4327,16556891,https://doi.org/10.1182/blood-2005-11-4327,,,
RE01314,Preclinical evaluation of a humanized NR-LU-10 antibody-streptavidin fusion protein for pretargeted cancer therapy,Cancer biotherapy & radiopharmaceuticals,2004-07-05,16,2,109-23,10.1089/108497801300189209,11385958,https://doi.org/10.1089/108497801300189209,,,
RE01315,Noninvasive Evaluation of CD20 Expression Using 64Cu-Labeled F(ab')2 Fragments of Obinutuzumab in Lymphoma,"Journal of nuclear medicine : official publication, Society of Nuclear Medicine",2020-08-21,62,3,372-378,10.2967/jnumed.120.246595,32826320,https://doi.org/10.2967/jnumed.120.246595,,,
RE01316,Targeted alpha immunotherapy of CD20-positive B-cell lymphoma model: dosimetry estimate of 225Ac-DOTA-rituximab using 64Cu-DOTA-rituximab,Annals of nuclear medicine,2021-04-03,35,5,639-647,10.1007/s12149-021-01607-6,33811601,https://doi.org/10.1007/s12149-021-01607-6,,,
RE01317,Targeted alpha immunotherapy of CD20-positive B-cell lymphoma model: dosimetry estimate of 225Ac-DOTA-rituximab using 64Cu-DOTA-rituximab,Annals of nuclear medicine,2021-04-03,35,5,639-647,10.1007/s12149-021-01607-6,33811601,https://doi.org/10.1007/s12149-021-01607-6,,,
RE01318,Evaluation of Next-Generation Anti-CD20 Antibodies Labeled with 89Zr in Human Lymphoma Xenografts,"Journal of nuclear medicine : official publication, Society of Nuclear Medicine",2018-01-18,59,8,1219-1224,10.2967/jnumed.117.203299,29348316,https://doi.org/10.2967/jnumed.117.203299,,,
RE01319,Theranostic Radiolabeled Anti-CD20 sdAb for Targeted Radionuclide Therapy of Non-Hodgkin Lymphoma,Molecular cancer therapeutics,2017-10-20,16,12,2828-2839,10.1158/1535-7163.MCT-17-0554,29054987,https://doi.org/10.1158/1535-7163.MCT-17-0554,,,
RE01320,Radioimmunotherapy of B-cell lymphoma with radiolabelled anti-CD20 monoclonal antibodies,Clinical and experimental medicine,2006-03-01,6,1,,10.1007/s10238-006-0087-6,16550338,https://doi.org/10.1007/s10238-006-0087-6,,,
