reference_id,title,journal,publication_date,volume,issue,pages,doi,pmid,url,notes,created_at,updated_at
RE00917,Trastuzumab cotreatment improves survival of mice with PC-3 prostate cancer xenografts treated with the GRPR antagonist 177 Lu-DOTAGA-PEG2 -RM26,International journal of cancer,2019-05-23,145,12,3347-3358,10.1002/jjc.32401,,https://doi.org/10.1002/jjc.32401,,,
RE00918,A Systematic Evaluation of Antibody Modification and 89Zr-Radiolabeling for Optimized Immuno-PET,Bioconjugate chemistry,2020-04-01,32,7,1177-1191,10.1021/acs.bioconjchem.0c00087,,https://doi.org/10.1021/acs.bioconjchem.0c00087,,,
RE00919,Evaluation of 99mTc-HYNIC-(ser)3-LTVPWY peptide for glioblastoma imaging,nternational journal of radiation biology,2019-12-20,96,4,502-509,10.1080/09553002.2020.1704906,,https://doi.org/10.1080/09553002.2020.1704906,,,
RE00920,Preparation of 177Lu-Trastuzumab injection for treatment of breast cancer,"Applied radiation and isotopes : including data, instrumentation and methods for use in agriculture, industry and medicine",2019-04-03,148,,184-190,10.1016/j.apradiso.2019.04.002,,https://doi.org/10.1016/j.apradiso.2019.04.002,,,
RE00921,Preparation and evaluation of 99mTc-labeled HYNIC-palbociclib analogs for cyclin-dependent kinase 4/6-positive tumor imaging,European journal of medicinal chemistry,2020-01-03,188,,112032,10.1016/j.ejmech.2019.112032,,https://doi.org/10.1016/j.ejmech.2019.112032,,,
RE00922,Alpha radioimmunotherapy using 225Ac-proteus-DOTA for solid tumors - safety at curative doses,Theranostics,2020-09-14,10,25,11359-11375,10.7150/thno.48810,,https://doi.org/10.7150/thno.48810,,,
RE00923,Influence of Histidine-Containing Tags on the Biodistribution of ADAPT Scaffold Proteins,Bioconjugate chemistry,2016-01-29,27,3,716-26,10.1021/acs.bioconjchem.5b00677,,https://doi.org/10.1021/acs.bioconjchem.5b00677,,,
RE00924,Radionuclide-Aided Improvement of the Therapeutic Efficacy of Novel Antibody-Drug Conjugates against HER2-Expressing Cancers,Molecular pharmaceutics,2025-05-31,22,7,3793-3802,10.1021/acs.molpharmaceut.5c00043,,https://doi.org/10.1021/acs.molpharmaceut.5c00043,,,
RE00925,Imaging and Monitoring HER2 Expression in Tumors during HER2 Antibody-Drug Conjugate Therapy Utilizing a Radiolabeled Site-Specific Single-Domain Antibody Probe: 68Ga-NODAGA-SNA004-GSC,Journal of medicinal chemistry,2024-07-30,67,15,12855-12867,10.1021/acs.jmedchem.4c00857,,https://doi.org/10.1021/acs.jmedchem.4c00857,,,
RE00926,Site-Specific Radiohalogenation of a HER2-Targeted Single-Domain Antibody Fragment Using a Novel Residualizing Prosthetic Agent,Journal of medicinal chemistry,2022-11-11,65,22,15358-15373,10.1021/acs.jmedchem.2c01331,,https://doi.org/10.1021/acs.jmedchem.2c01331,,,
RE00927,HER2-Targeted Affibody Molecule 99mTc-ABH2 for Imaging HER2 Expression in Breast Cancer,Clinical nuclear medicine,2025-01-01,50,1,25-30,10.1097/RLU.000000000005535,,https://doi.org/10.1097/RLU.000000000005535,,,
RE00928,[52Mn]Mn-BPPA-Trastuzumab: A Promising HER2-Specific PET Radiotracer,Journal of medicinal chemistry,2024-05-01,67,10,8261-8270,10.1021/acs.jmedchem.4c00344,,https://doi.org/10.1021/acs.jmedchem.4c00344,,,
RE00929,In vitro and in vivo evaluation of anti-HER2 antibody conjugates labelled with 225Ac,EJNMMI radiopharmacy and chemistry,2025-04-04,10,1,16,10.1186/s41181-025-00337-8,,https://doi.org/10.1186/s41181-025-00337-8,,,
RE00930,Experimental Therapy of HER2-Expressing Xenografts Using the Second-Generation HER2-Targeting Affibody Molecule 188Re-ZHER2:41071,Pharmaceutics,2022-05-20,14,5,1092,10.3390/pharmaceuticals14051092,,https://doi.org/10.3390/pharmaceuticals14051092,,,
RE00931,In Silico Design and Evaluation of Novel Peptide-Based PET Probe for Noninvasive Imaging of HER2 Expression in Breast Cancer,Journal of medicinal chemistry,2025-05-05,68,10,10461-10472,10.1021/acs.jmedchem.5c00760,,https://doi.org/10.1021/acs.jmedchem.5c00760,,,
RE00932,High in-vivo stability in preclinical and first-in-human experiments with [18F]AlF-RESCA-MIRC213: a 18F-labeled nanobody as PET radiotracer for diagnosis of HER2-positive cancers,European journal of nuclear medicine and molecular imaging,2022-09-21,50,2,302-313,10.1007/s00259-022-05967-7,,https://doi.org/10.1007/s00259-022-05967-7,,,
RE00933,Evaluation of 68Ga-Radiolabeled Peptides for HER2 PET Imaging,"Diagnostics (Basel, Switzerland)",2022-11-05,12,11,2710,10.3390/diagnostics12112710,,https://doi.org/10.3390/diagnostics12112710,,,
RE00934,The preclinical study of 177Lu-DOTA-LTVSPWY as a potential therapeutic agent against HER2 overexpressed cancer,Annals of nuclear medicine,2023-04-28,37,7,400-409,10.1007/s12149-023-01839-8,,https://doi.org/10.1007/s12149-023-01839-8,,,
RE00935,Pre-Clinical Study of the [18F]AlF-Labeled HER2 Affibody for Non-Invasive HER2 Detection in Gastric Cancer,Frontiers in medicine,2022-02-16,9,,803005,10.3389/fmed.2022.803005,,https://doi.org/10.3389/fmed.2022.803005,,,
RE00937,Site-Specifically Labeled Antibody-Drug Conjugate for Simultaneous Therapy and ImmunoPET,Molecular pharmaceutics,2018-02-02,15,3,892-898,10.1021/acs.molpharmaceut.7b00802,,https://doi.org/10.1021/acs.molpharmaceut.7b00802,,,
RE00938,"Phage Display Selection, In Vitro Characterization, and Correlative PET Imaging of a Novel HER3 Peptide",Molecular imaging and biology,2017-07-21,20,2,300-308,10.1007/s11307-017-1106-6,,https://doi.org/10.1007/s11307-017-1106-6,,,
RE00939,89Zr-Radiolabelling of p-NCS-Bz-DFO-Anti-HER2 Affibody Immunoconjugate: Characterization and Assessment of In Vitro Potential in HER2-Positive Breast Cancer Imaging,Pharmaceutics,2025-06-04,17,6,739,10.3390/pharmaceutics17060739,,https://doi.org/10.3390/pharmaceutics17060739,,,
RE00940,111In-labeled anti-cadherin17 antibody D2101 has potential as a noninvasive imaging probe for diagnosing gastric cancer and lymph-node metastasis,Annals of nuclear medicine,2019-10-12,34,1,13-23,10.1007/s12149-019-01408-y,,https://doi.org/10.1007/s12149-019-01408-y,,,
RE00941,Ubiquinol Ameliorates Endothelial Dysfunction in Subjects with Mild-to-Moderate Dyslipidemia: A Randomized Clinical Trial,Nutrients,2020-04-15,12,4,1098,10.3390/cancers12041017,,https://doi.org/10.3390/cancers12041017,,,
RE00942,Ubiquinol Ameliorates Endothelial Dysfunction in Subjects with Mild-to-Moderate Dyslipidemia: A Randomized Clinical Trial,Nutrients,2020-04-15,12,4,1098,10.3390/cancers12041017,,https://doi.org/10.3390/cancers12041017,,,
RE00943,Evaluation of HER2-specific peptide ligand for its employment as radiolabeled imaging probe,Scientific reports,2018-02-14,8,1,2998, 10.1038/s41598-018-21283-3,,https://doi.org/ 10.1038/s41598-018-21283-3,,,
RE00944,Preparation and Identification of HER2 Radioactive Ligands and Imaging Study of Breast Cancer-Bearing Nude Mice,Translational oncology,2017-05-27,10,4,518-526,10.1016/j.tranon.2017.04.003,,https://doi.org/10.1016/j.tranon.2017.04.003,,,
RE00945,Polyethylene glycol-conjugated HER2-targeted peptides as a nuclear imaging probe for HER2-overexpressed gastric cancer detection in vivo,Journal of translational medicine,2018-06-19,16,1,29921305,10.1186/s12967-018-1550-3,,https://doi.org/10.1186/s12967-018-1550-3,,,
RE00946,Targeting HER2-positive gastric cancer with a novel 18F-labeled ZHER2:342 probe,RSC advances,2019-04-08,9,19,10990-10998,10.1039/c8ra10271f,,https://doi.org/10.1039/c8ra10271f,,,
RE00947,PET Imaging of HER2-Positive Tumors with Cu-64-Labeled Affibody Molecules,Molecular imaging and biology,2019-01-07,21,5,907-916,10.1007/s11307-018-01310-5,,https://doi.org/10.1007/s11307-018-01310-5,,,
RE00948,New small 99mTc-labeled peptides for HER2 receptor imaging,European journal of medicinal chemistry,2016-11-09,127,,1012-1024,10.1016/j.ejmech.2016.11.011,,https://doi.org/10.1016/j.ejmech.2016.11.011,,,
RE00949,Developing PEGylated Reversed D-Peptide as a Novel HER2-Targeted SPECT Imaging Probe for Breast Cancer Detection,Bioconjugate chemistry,2020-07-24,31,8,1971-1980,10.1021/acs.bioconjchem.0c00334,,https://doi.org/10.1021/acs.bioconjchem.0c00334,,,
RE00950,Protection efficacy of the Brucella abortus ghost vaccine candidate lysed by the N-terminal 24-amino acid fragment (GI24) of the 36-amino acid peptide PMAP-36 (porcine myeloid antimicrobial peptide 36) in murine models.,The Journal of veterinary medical science,2016-06-05,78,10,1541-1548,10.3892/ol.2016.4990,,https://doi.org/10.3892/ol.2016.4990,,,
RE00951,Downregulation of Mitochondrial Single Stranded DNA Binding Protein (SSBP1) Induces Mitochondrial Dysfunction and Increases the Radiosensitivity in Non-Small Cell Lung Cancer Cells,Journal of Cancer,2017-05-12,8,8,1400-1409,10.7150/jca.18170,,https://doi.org/10.7150/jca.18170,,,
RE00952,Comparative evaluation of dimeric and monomeric forms of ADAPT scaffold protein for targeting of HER2-expressing tumours,European journal of pharmaceutics and biopharmaceutics : official journal of Arbeitsgemeinschaft fur Pharmazeutische Verfahrenstechnik e.V,2018-11-05,134,,37-48,10.1016/j.ejpb.2018.11.004,,https://doi.org/10.1016/j.ejpb.2018.11.004,,,
RE00953,Feasibility of Affibody Molecule-Based PNA-Mediated Radionuclide Pretargeting of Malignant Tumors,Theranostics,2016-01-01,6,1,93-103,10.7150/thno.12766,,https://doi.org/10.7150/thno.12766,,,
RE00954,Backbone and methyl assignment of bacteriorhodopsin incorporated into nanodiscs,Journal of biomolecular NMR,2019-11-21,74,1,45-60,10.1186/s13550-019-0564-z,,https://doi.org/10.1186/s13550-019-0564-z,,,
RE00955,Labeling of Anti-HER2 Nanobodies with Astatine-211: Optimization and the Effect of Different Coupling Reagents on Their in Vivo Behavior,Molecular pharmaceutics,2019-07-03,16,8,3524-3533,10.1021/acs.molpharmaceut.9b00354,,https://doi.org/10.1021/acs.molpharmaceut.9b00354,,,
RE00956,Radionuclide Tumor Targeting Using ADAPT Scaffold Proteins: Aspects of Label Positioning and Residualizing Properties of the Label,"Journal of nuclear medicine : official publication, Society of Nuclear Medicine",2017-09-01,59,1,93-99,10.2967/jnumed.117.197202,,https://doi.org/10.2967/jnumed.117.197202,,,
RE00957,Improved Immuno-PET Imaging of HER2-Positive Tumors in Mice: Urokinase Injection-Triggered Clearance Enhancement of 64Cu-Trastuzumab,Molecular pharmaceutics,2019-01-30,16,3,1065-1073,10.1021/acs.molpharmaceut.8b01052,,https://doi.org/10.1021/acs.molpharmaceut.8b01052,,,
RE00958,Site-specific conjugation of recognition tags to trastuzumab for peptide nucleic acid-mediated radionuclide HER2 pretargeting,Biomaterials,2019-02-14,203,,73-85,10.1016/j.biomaterials.2019.02.012,,https://doi.org/10.1016/j.biomaterials.2019.02.012,,,
RE00959,Optimized Molecular Design of ADAPT-Based HER2-Imaging Probes Labeled with 111In and 68Ga,Molecular pharmaceutics,2018-06-20,15,7,2674-2683,10.1021/acs.molpharmaceut.8b00204,,https://doi.org/10.1021/acs.molpharmaceut.8b00204,,,
RE00960,A comparison of 111In- or 64Cu-DOTA-trastuzumab Fab fragments for imaging subcutaneous HER2-positive tumor xenografts in athymic mice using microSPECT/CT or microPET/CT, EJNMMI Research,2011-08-17,1,,15,10.1186/2191-219X-1-15,21884646,https://doi.org/10.1186/2191-219X-1-15,,,
RE00962,Aminooxy-functionalized DOTA for radiolabeling of oxidized antibodies: evaluation of site-specific 111In-labeled trastuzumab,,2012-07-12,55,9,346-353,10.1002/jlcr.2950,,https://doi.org/10.1002/jlcr.2950,,,
RE00963,Aminooxy-functionalized DOTA for radiolabeling of oxidized antibodies: evaluation of site-specific 111In-labeled trastuzumab,,2012-07-12,55,9,346-353,10.1002/jlcr.2950,,https://doi.org/10.1002/jlcr.2950,,,
RE00964,Multimodality nuclear and fluorescence tumor imaging in mice using a streptavidin nanoparticle,Bioconjugate chemistry,2010-07-21,21,7,1385-8,10.1021/bc100081h,,https://doi.org/10.1021/bc100081h,,,
RE00965,"HAHAHA, HEHEHE, HIHIHI, or HKHKHK: influence of position and composition of histidine containing tags on biodistribution of [(99m)Tc(CO)3](+)-labeled affibody molecules",Journal of medicinal chemistry,2013-06-14,56,12,4966-74,10.1021/jm400218y,,https://doi.org/10.1021/jm400218y,,,
RE00966,Synthesis and Preliminary Biological Evaluations of Fluorescent or 149Promethium Labeled Trastuzumab-Polyethylenimine,Biomedicines,2015-12-30,4,1,28536369,10.3390/biomedicines4010001,,https://doi.org/10.3390/biomedicines4010001,,,
RE00967,Position for site-specific attachment of a DOTA chelator to synthetic affibody molecules has a different influence on the targeting properties of 68Ga- compared to 111in-labeled conjugates,Molecular imaging,2014-12-01,13,,10.2310/7290.2014.00034,10.2310/7290.2014.00034,,https://doi.org/10.2310/7290.2014.00034,,,
RE00968,"188Re-ZHER2:V2, a promising affibody-based targeting agent against HER2-expressing tumors: preclinical assessment","Journal of nuclear medicine : official publication, Society of Nuclear Medicine",2014-10-02,55,11,1842-8,10.2967/jnumed.114.140194,,https://doi.org/10.2967/jnumed.114.140194,,,
RE00969,⁸⁹Zr-Labeled Versus ¹²⁴I-Labeled αHER2 Fab with Optimized Plasma Half-Life for High-Contrast Tumor Imaging In Vivo,"Journal of nuclear medicine : official publication, Society of Nuclear Medicine",2015-05-21,56,7,1112-8,10.2967/jnumed.114.149690,,https://doi.org/10.2967/jnumed.114.149690,,,
RE00970,Imaging of human epidermal growth factor receptor type 2 expression with 18F-labeled affibody molecule ZHER2:2395 in a mouse model for ovarian cancer,"Journal of nuclear medicine : official publication, Society of Nuclear Medicine",2011-12-15,53,1,146-53,10.2967/jnumed.111.093047,,https://doi.org/10.2967/jnumed.111.093047,,,
RE00971,Preclinical evaluation of 227Th-labeled and 177Lu-labeled trastuzumab in mice with HER-2-positive ovarian cancer xenografts,Nuclear medicine communications,2012-08-01,33,8,838-47,10.1097/MNM.0b013e328354df7c,,https://doi.org/10.1097/MNM.0b013e328354df7c,,,
RE00972,Biodistribution of 212Pb conjugated trastuzumab in mice,Journal of nuclear medicine,2012-10-18,296,,75-81,10.1007/s10967-012-2243-7,,https://doi.org/10.1007/s10967-012-2243-7,,,
RE00973,Bifunctional (64)Cu-labelled macrobicyclic cage amine isothiocyanates for immuno-positron emission tomography,"Dalton transactions (Cambridge, England : 2003) ",2015-03-21,44,11,Sep-91,10.1039/c4dt02983f,,https://doi.org/10.1039/c4dt02983f,,,
RE00974,Direct comparison of 111In-labelled two-helix and three-helix Affibody molecules for in vivo molecular imaging,European journal of nuclear medicine and molecular imaging,2011-12-15,39,4,693-702,10.1007/s00259-011-2016-5,,https://doi.org/10.1007/s00259-011-2016-5,,,
RE00975,Comparison of bifunctional chelates for (64)Cu antibody imaging,European journal of nuclear medicine and molecular imaging,2010-06-16,37,11,2117-26,10.1007/s00259-010-1506-1,,https://doi.org/10.1007/s00259-010-1506-1,,,
RE00976,A pretherapy biodistribution and dosimetry study of indium-111-radiolabeled trastuzumab in patients with human epidermal growth factor receptor 2-overexpressing breast cancer,Cancer biotherapy & radiopharmaceuticals,2010-08-24,25,4,387-94,10.1089/cbr.2010.0783,,https://doi.org/10.1089/cbr.2010.0783,,,
RE00977,Fractionated therapy of HER2-expressing breast and ovarian cancer xenografts in mice with targeted alpha emitting 227Th-DOTA-p-benzyl-trastuzumab,PloS one,2012-08-03,7,8,e42345,10.1371/journal.pone.0042345,,https://doi.org/10.1371/journal.pone.0042345,,,
RE00978,H(4)octapa-trastuzumab: versatile acyclic chelate system for 111In and 177Lu imaging and therapy,Journal of the American Chemical Society,2013-08-15,135,34,12707-21,10.1021/ja4049493,,https://doi.org/10.1021/ja4049493,,,
RE00979,(67/68)Ga-labeling agent that liberates (67/68)Ga-NOTA-methionine by lysosomal proteolysis of parental low molecular weight polypeptides to reduce renal radioactivity levels,Bioconjugate chemistry,2014-10-22,25,11,2048-45,10.1021/bc5004058,,https://doi.org/10.1021/bc5004058,,,
RE00980,In vivo examination of (188)Re(I)-tricarbonyl-labeled trastuzumab to target HER2-overexpressing breast cancer,Nuclear medicine and biology,2009-03-26,36,4,355-61,10.1016/j.nucmedbio.2009.01.006,,https://doi.org/10.1016/j.nucmedbio.2009.01.006,,,
RE00981,"Synthesis, preclinical validation, dosimetry, and toxicity of 68Ga-NOTA-anti-HER2 Nanobodies for iPET imaging of HER2 receptor expression in cancer","Journal of nuclear medicine : official publication, Society of Nuclear Medicine",2013-03-13,54,5,776-84,10.2967/jnumed.112.111021,,https://doi.org/10.2967/jnumed.112.111021,,,
RE00982,Preclinical screening of anti-HER2 nanobodies for molecular imaging of breast cancer,FASEB journal : official publication of the Federation of American Societies for Experimental Biology,2011-04-08,25,7,2433-46,10.1096/fj.10-180331,,https://doi.org/10.1096/fj.10-180331,,,
RE00983,"Comparative evaluation of synthetic anti-HER2 Affibody molecules site-specifically labelled with 111In using N-terminal DOTA, NOTA and NODAGA chelators in mice bearing prostate cancer xenografts",European journal of nuclear medicine and molecular imaging,2011-11-30,39,3,481-92,10.1007/s00259-011-1992-9,,https://doi.org/10.1007/s00259-011-1992-9,,,
RE00984,Trastuzumab labeled to high specific activity with ¹¹¹In by conjugation to G4 PAMAM dendrimers derivatized with multiple DTPA chelators exhibits increased cytotoxic potency on HER2-positive breast cancer cells,Pharmaceutical research,2013-04-25,30,8,1999-2009,10.1007/s11095-013-1044-1,,https://doi.org/10.1007/s11095-013-1044-1,,,
RE00985,The potential of SOCTA as a chelator for radiolabeling of trastuzumab with 99mTc,J Radioanal Nucl Chem,2015-07-30,307,,0353-1357,10.1007/s10967-015-4314-z,,https://doi.org/10.1007/s10967-015-4314-z,,,
RE00986,Evaluation of a HER2-targeting affibody molecule combining an N-terminal HEHEHE-tag with a GGGC chelator for 99mTc-labelling at the C terminus,Tumour biology : the journal of the International Society for Oncodevelopmental Biology and Medicine,2012-01-17,33,3,641-51,10.1007/s13277-011-0305-z,,https://doi.org/10.1007/s13277-011-0305-z,,,
RE00987,HER2-positive tumors imaged within 1 hour using a site-specifically 11C-labeled Sel-tagged affibody molecule,"Journal of nuclear medicine : official publication, Society of Nuclear Medicine",2012-08-07,53,9,1446-53,10.2967/jnumed.111.102194,,https://doi.org/10.2967/jnumed.111.102194,,,
RE00988,"Targeting of HER2-expressing tumors with a site-specifically 99mTc-labeled recombinant affibody molecule, ZHER2:2395, with C-terminally engineered cysteine","Journal of nuclear medicine : official publication, Society of Nuclear Medicine",2009-04-16,50,5,781-9,10.2967/jnumed.108.056929,,https://doi.org/10.2967/jnumed.108.056929,,,
RE00989,Influence of nuclides and chelators on imaging using affibody molecules: comparative evaluation of recombinant affibody molecules site-specifically labeled with ⁶⁸Ga and ¹¹¹In via maleimido derivatives of DOTA and NODAGA,Bioconjugate chemistry,2013-06-05,24,6,1102-9,10.1021/bc300678y,,https://doi.org/10.1021/bc300678y,,,
RE00990,"Design, synthesis and biological evaluation of a multifunctional HER2-specific Affibody molecule for molecular imaging",European journal of nuclear medicine and molecular imaging,2009-06-06,36,11,1864-73,10.1007/s00259-009-1176-z,,https://doi.org/10.1007/s00259-009-1176-z,,,
RE00991,Evaluation of a maleimido derivative of NOTA for site-specific labeling of affibody molecules,Bioconjugate chemistry,2011-04-12,22,5,894-902,10.1021/bc100470x,,https://doi.org/10.1021/bc100470x,,,
RE00992,"Evaluation of a 1,4,7,10-tetraazacyclododecane-1,4,7,10-tetraacetic acid-conjugated bombesin-based radioantagonist for the labeling with single-photon emission computed tomography, positron emission tomography, and therapeutic radionuclides",Clin Cancer Res,2009-08-15,15,16,52400-9,10.1158/1078-0432.CCR-08-3145,,https://doi.org/10.1158/1078-0432.ccr-08-3145,,,
RE00993,"Design, Synthesis, In Vitro, and Initial In Vivo Evaluation of Heterobivalent Peptidic Ligands Targeting Both NPY(Y?)- and GRP-Receptors-An Improvement for Breast Cancer Imaging?",Pharmaceuticals (Basel),2018-07-04,11,3,65,10.3390/ph11030065,29973529,https://doi.org/10.3390/ph11030065,,,
RE00994,Prospective Study of the Radiolabeled GRPR Antagonist BAY86-7548 for Positron Emission Tomography/Computed Tomography Imaging of Newly Diagnosed Prostate Cancer,Eur Urol Oncol,2019-03-01,2,2,166-173,10.1016/j.euo.2018.08.011,,https://doi.org/10.1016/j.euo.2018.08.011,,,
RE00995,Synthesis and characterization of a high-affinity NOTA-conjugated bombesin antagonist for GRPR-targeted tumor imaging,Bioconjug Chem,2013-07-17,24,7,1144-53,10.1021/bc300659k,,https://doi.org/10.1021/bc300659k,,,
RE00996,"Side-by-side comparison of the two widely studied GRPR radiotracers, radiolabeled NeoB and RM2, in a preclinical setting",Eur J Nucl Med Mol Imaging,2023-11-01,50,13,3851-3861,10.1007/s00259-023-06364-4,,https://doi.org/10.1007/s00259-023-06364-4,,,
RE00997,Comparative evaluation of radiolabeled bombesin analogs [177Lu]Lu-AMBA and [177Lu]Lu-RM2 for targeting GRPR in glioblastoma model,Nucl Med Biol,2025-07-01,146,147,109041,10.1016/j.nucmedbio.2025.109041,,https://doi.org/10.1016/j.nucmedbio.2025.109041,,,
RE00998,Two Novel [68Ga]Ga-Labeled Radiotracers Based on Metabolically Stable [Sar11]RM26 Antagonistic Peptide for Diagnostic Positron Emission Tomography Imaging of GRPR-Positive Prostate Cancer,ACS Omega,2024-04-10,9,16,18608-18616,10.1021/acsomega.4c01348,,https://doi.org/10.1021/acsomega.4c01348,,,
RE00999,Copper-67-Labeled Bombesin Peptide for Targeted Radionuclide Therapy of Prostate Cancer,Pharmaceuticals (Basel),2022-06-08,15,6,728,10.3390/ph15060728,,https://doi.org/10.3390/ph15060728,,,
RE01000,A Radiotracer for Molecular Imaging and Therapy of Gastrin-Releasing Peptide Receptor-Positive Prostate Cancer,J Nucl Med,2022-03-01,63,3,424-430,10.2967/jnumed.120.257758,,https://doi.org/10.2967/jnumed.120.257758,,,
RE01001,[99mTc]Tc-HYNIC-RM2: A potential SPECT probe targeting GRPR expression in prostate cancers,Nucl Med Biol,2023-03-01,118,119,108331,10.1016/j.nucmedbio.2023.108331,,https://doi.org/10.1016/j.nucmedbio.2023.108331,,,
RE01002,"The GRPR Antagonist [99mTc]Tc-maSSS-PEG2-RM26 towards Phase I Clinical Trial: Kit Preparation, Characterization and Toxicity",Diagnostics (Basel),2023-05-02,13,9,1611,10.3390/diagnostics13091611,,https://doi.org/10.3390/diagnostics13091611,,,
RE01003,Preclinical evaluation of new GRPR-antagonists with improved metabolic stability for radiotheranostic use in oncology,EJNMMI Radiopharm Chem,2024-02-16,9,1,13,10.1186/s41181-024-00242-6,,https://doi.org/10.1186/s41181-024-00242-6,,,
RE01004,Radiometal Complexes as Pharmacokinetic Modifiers: A Potent 68Ga-Labeled Gastrin-Releasing Peptide Receptor Antagonist Based on the Macrocyclic Metal Chelator NODIA-Me,Mol Pharm,2023-12-04,20,12,6463-6473,10.1021/acs.molpharmaceut.3c00852,,https://doi.org/10.1021/acs.molpharmaceut.3c00852,,,
RE01005,Design and synthesis of GRPR-targeted PET probes based on Dar derivatives for imaging of prostate cancer,Nanomedicine,2025-07-01,67,,102829,10.1016/j.nano.2025.102829,,https://doi.org/10.1016/j.nano.2025.102829,,,
RE01006,Design and synthesis of GRPR-targeted PET probes based on Dar derivatives for imaging of prostate cancer,Nanomedicine,2025-07-01,67,,102829,10.1016/j.nano.2025.102829,,https://doi.org/10.1016/j.nano.2025.102829,,,
RE01007,PET Probes for Preclinical Imaging of GRPR-Positive Prostate Cancer: Comparative Preclinical Study of [68Ga]Ga-NODAGA-AMBA and [44Sc]Sc-NODAGA-AMBA,Int J Mol Sci,2022-09-02,23,17,10061,10.3390/ijms231710061,,https://doi.org/10.3390/ijms231710061,,,
RE01008,Preclinical Characterisation of PSMA/GRPR-Targeting Heterodimer [68Ga]Ga-BQ7812 for PET Diagnostic Imaging of Prostate Cancer: A Step towards Clinical Translation,Cancers (Basel),2023-01-10,15,2,442,10.3390/cancers15020442,,https://doi.org/10.3390/cancers15020442,,,
RE01009,Design and Synthesis of 68Ga-Labeled Peptide-Based Heterodimers for Dual Targeting of NTS1 and GRPR,ChemMedChem,2025-05-05,20,9,e202400843,10.1002/cmdc.202400843,,https://doi.org/10.1002/cmdc.202400843,,,
RE01010,Preclinical Investigation of [212Pb]Pb-DOTAM-GRPR1 for Peptide Receptor Radionuclide Therapy in a Prostate Tumor Model,J Nucl Med,2024-11-01,65,11,1769-1775,10.2967/jnumed.124.268101,,https://doi.org/10.2967/jnumed.124.268101,,,
RE01011,68Ga-Labeled [Leu13肉Thz14]Bombesin(7-14) Derivatives: Promising GRPR-Targeting PET Tracers with Low Pancreas Uptake,Molecules,2022-06-11,27,12,3777,10.3390/molecules27123777,,https://doi.org/10.3390/molecules27123777,,,
RE01012,Choice of an Optimal Modular Strategy for the Synthesis of DOTA-Containing Heterobivalent Agents Targeting PSMA and GRPr,Bioconjug Chem,2025-04-16,36,4,748-761,10.1021/acs.bioconjchem.5c00033,,https://doi.org/10.1021/acs.bioconjchem.5c00033,,,
RE01013,GRPR-Antagonists Carrying DOTAGA-Chelator via Positively Charged Linkers: Perspectives for Prostate Cancer Theranostics,Pharmaceutics,2024-04-08,16,4,513,10.3390/pharmaceutics16040513,,https://doi.org/10.3390/pharmaceutics16040513,,,
RE01014,Diagnosis of Prostate Cancer with a Neurotensin-Bombesin Radioligand Combination-First Preclinical Results,Pharmaceutics,2024-09-19,16,9,1223,10.3390/pharmaceutics16091223,,https://doi.org/10.3390/pharmaceutics16091223,,,
RE01015,Novel GRPR-Targeting Peptide for Pancreatic Cancer Molecular Imaging in Orthotopic and Liver Metastasis Mouse Models,Anal Chem,2023-08-01,95,30,11429-11439,10.1021/acs.analchem.3c01765,,https://doi.org/10.1021/acs.analchem.3c01765,,,
RE01016,First-in-Human Serum Stability Studies of [177Lu]Lu-AMTG: A Step Toward Improved GRPR-Targeted Radiopharmaceutical Therapy,J Nucl Med,2025-06-02,66,6,896-899,10.2967/jnumed.124.269132,,https://doi.org/10.2967/jnumed.124.269132,,,
RE01017,Development of Novel Gastrin-Releasing Peptide Receptor-Targeted Radioligand with Albumin Binder to Improve Accumulation in Tumor,ACS Med Chem Lett,2025-04-25,16,5,797-803,10.1021/acsmedchemlett.5c00032,,https://doi.org/10.1021/acsmedchemlett.5c00032,,,
